{
  "$schema": "https://raw.githubusercontent.com/AngelMunoz/Perla/fs-rework/perla.templates.schema.json",
  "name": "Perla Templates",
  "description": "Official Perla template starters",
  "author": "Perla",
  "license": "MIT",
  "repository": "https://github.com/AngelMunoz/perla-templates",
  "group": "perla.templates",
  "templates": [
    {
      "id": "basic",
      "name": "Basic Template",
      "shortname": "basic",
      "path": "./basic",
      "description": "Just perla.json and index.html, nothing more, nothing less."
    },
    {
      "id": "fable.feliz",
      "name": "Fable Feliz",
      "shortname": "feliz",
      "path": "./fable-feliz",
      "description": "Fable Compiler + Feliz React SPA template"
    },
    {
      "id": "fable.lit",
      "name": "Fable Lit",
      "shortname": "flit",
      "path": "./fable-lit",
      "description": "Fable Compiler + Lit SPA template"
    },
    {
      "id": "fable.sutil",
      "name": "Fable Sutil",
      "shortname": "fsutil",
      "path": "./fable-sutil",
      "description": "Fable Compiler + Sutil F# Framework SPA template"
    },
    {
      "id": "lit.js",
      "name": "Lit Javascript",
      "shortname": "litjs",
      "path": "./lit-js",
      "description": "Lit WebComponent Framework SPA template"
    },
    {
      "id": "preact.jsx",
      "name": "Preact JSX",
      "shortname": "prejsx",
      "path": "./preact-jsx",
      "description": "Preact JSX SPA template"
    },
    {
      "id": "preact.tsx",
      "name": "Preact TSX",
      "shortname": "pretsx",
      "path": "./preact-tsx",
      "description": "Preact TSX SPA template"
    },
    {
      "id": "react.jsx",
      "name": "React Jsx",
      "shortname": "react",
      "path": "./react-jsx",
      "description": "React JSX SPA template"
    },
    {
      "id": "react.tsx",
      "name": "React TSX",
      "shortname": "reacts",
      "path": "./react-tsx",
      "description": "React TSX SPA template"
    },
    {
      "id": "solid.js",
      "name": "Solid JS",
      "shortname": "solid",
      "path": "./solid-js",
      "description": "Solidjs Web SPA template"
    },
    {
      "id": "vue.jsx",
      "name": "VUE JSX",
      "shortname": "vuejsx",
      "path": "./vue-jsx",
      "description": "Vue.js JSX SPA template"
    }
  ]
}
